{
  "schema_version": "1.0",
  "description": "A source-grounded planning map. Course prerequisites and pathway order are instructional planning proposals; they do not establish university equivalency, admission eligibility, transfer credit, or affiliation.",
  "catalog_only": [
    {
      "id": "precalculus",
      "title": "Precalculus and Quantitative Foundations",
      "domain": "Mathematics",
      "level": "Foundation",
      "maturity": "catalog-only",
      "description": "Build fluency with functions, trigonometry, vectors, logarithms, and algebraic models used before calculus-based science and engineering.",
      "prerequisites": {
        "course_ids": [],
        "recommended_course_ids": [],
        "concurrent_course_ids": [],
        "knowledge": [
          "Algebra and geometry"
        ],
        "statement": "Preparation: Algebra and geometry. This planning entry does not establish any university's admission or course-equivalency rules."
      },
      "related_package_ids": [],
      "relation_note": null
    },
    {
      "id": "numerical-methods",
      "title": "Numerical Methods for Scientific Computing",
      "domain": "Computing",
      "level": "Year 2",
      "maturity": "catalog-only",
      "description": "Study floating-point error, root finding, linear systems, interpolation, numerical differentiation and integration, and reproducible simulation.",
      "prerequisites": {
        "course_ids": [
          "programming",
          "calculus-2",
          "linear-algebra"
        ],
        "recommended_course_ids": [
          "statistics"
        ],
        "concurrent_course_ids": [],
        "knowledge": [],
        "statement": "Recommended sequence: Programming and Numerical Methods; Calculus II; Linear Algebra; Probability and Statistics (recommended). These project-planned dependencies do not establish any university's admission or course-equivalency rules."
      },
      "related_package_ids": [],
      "relation_note": null
    },
    {
      "id": "statics",
      "title": "Engineering Statics",
      "domain": "Mechanical engineering",
      "level": "Year 2",
      "maturity": "catalog-only",
      "description": "Model force and moment equilibrium in particles, rigid bodies, trusses, frames, and biomedical structures with explicit free-body diagrams.",
      "prerequisites": {
        "course_ids": [
          "physics-mechanics",
          "calculus-1"
        ],
        "recommended_course_ids": [],
        "concurrent_course_ids": [],
        "knowledge": [],
        "statement": "Recommended sequence: Classical Mechanics; Calculus I. These project-planned dependencies do not establish any university's admission or course-equivalency rules."
      },
      "related_package_ids": [
        "statics-materials"
      ],
      "relation_note": "This partial prototype package groups related topics; this catalog entry does not split or claim full-course coverage from that package."
    },
    {
      "id": "dynamics",
      "title": "Engineering Dynamics",
      "domain": "Mechanical engineering",
      "level": "Year 2",
      "maturity": "catalog-only",
      "description": "Analyze particle and rigid-body kinematics, work-energy, impulse-momentum, and rotational motion using coordinate choices and physical checks.",
      "prerequisites": {
        "course_ids": [
          "physics-mechanics",
          "calculus-1"
        ],
        "recommended_course_ids": [
          "statics"
        ],
        "concurrent_course_ids": [],
        "knowledge": [],
        "statement": "Recommended sequence: Classical Mechanics; Calculus I; Engineering Statics (recommended). These project-planned dependencies do not establish any university's admission or course-equivalency rules."
      },
      "related_package_ids": [],
      "relation_note": null
    },
    {
      "id": "mechanics-of-materials",
      "title": "Mechanics of Materials",
      "domain": "Mechanical engineering",
      "level": "Year 2",
      "maturity": "catalog-only",
      "description": "Relate axial, bending, torsional, and combined loads to stress, strain, deformation, failure criteria, and design margins.",
      "prerequisites": {
        "course_ids": [
          "statics"
        ],
        "recommended_course_ids": [
          "materials-science"
        ],
        "concurrent_course_ids": [],
        "knowledge": [],
        "statement": "Recommended sequence: Engineering Statics; Materials Science for Engineers (recommended). These project-planned dependencies do not establish any university's admission or course-equivalency rules."
      },
      "related_package_ids": [
        "statics-materials"
      ],
      "relation_note": "This partial prototype package groups related topics; this catalog entry does not split or claim full-course coverage from that package."
    },
    {
      "id": "thermodynamics",
      "title": "Engineering Thermodynamics",
      "domain": "Mechanical engineering",
      "level": "Year 2",
      "maturity": "catalog-only",
      "description": "Apply conservation of mass and energy, state properties, entropy balances, and idealized cycles while stating model assumptions.",
      "prerequisites": {
        "course_ids": [
          "general-chemistry-2",
          "calculus-2"
        ],
        "recommended_course_ids": [],
        "concurrent_course_ids": [],
        "knowledge": [],
        "statement": "Recommended sequence: General Chemistry II; Calculus II. These project-planned dependencies do not establish any university's admission or course-equivalency rules."
      },
      "related_package_ids": [
        "transport"
      ],
      "relation_note": "This partial prototype package groups related topics; this catalog entry does not split or claim full-course coverage from that package."
    },
    {
      "id": "fluid-mechanics",
      "title": "Fluid Mechanics",
      "domain": "Mechanical engineering",
      "level": "Year 3",
      "maturity": "catalog-only",
      "description": "Use hydrostatics, control-volume conservation, dimensional reasoning, viscous-flow models, and pressure-flow relations in biological and engineered systems.",
      "prerequisites": {
        "course_ids": [
          "physics-mechanics",
          "calculus-2"
        ],
        "recommended_course_ids": [
          "thermodynamics"
        ],
        "concurrent_course_ids": [],
        "knowledge": [],
        "statement": "Recommended sequence: Classical Mechanics; Calculus II; Engineering Thermodynamics (recommended). These project-planned dependencies do not establish any university's admission or course-equivalency rules."
      },
      "related_package_ids": [
        "transport"
      ],
      "relation_note": "This partial prototype package groups related topics; this catalog entry does not split or claim full-course coverage from that package."
    },
    {
      "id": "heat-mass-transfer",
      "title": "Heat and Mass Transfer",
      "domain": "Mechanical engineering",
      "level": "Year 3",
      "maturity": "catalog-only",
      "description": "Compare conduction, convection, diffusion, and interfacial transfer through governing balances, boundary conditions, and characteristic scales.",
      "prerequisites": {
        "course_ids": [
          "differential-equations",
          "thermodynamics",
          "fluid-mechanics"
        ],
        "recommended_course_ids": [],
        "concurrent_course_ids": [],
        "knowledge": [],
        "statement": "Recommended sequence: Differential Equations; Engineering Thermodynamics; Fluid Mechanics. These project-planned dependencies do not establish any university's admission or course-equivalency rules."
      },
      "related_package_ids": [
        "transport"
      ],
      "relation_note": "This partial prototype package groups related topics; this catalog entry does not split or claim full-course coverage from that package."
    },
    {
      "id": "materials-science",
      "title": "Materials Science for Engineers",
      "domain": "Materials science",
      "level": "Year 2",
      "maturity": "catalog-only",
      "description": "Connect atomic structure and processing to mechanical, electrical, thermal, degradation, and biological-interface properties of engineering materials.",
      "prerequisites": {
        "course_ids": [
          "general-chemistry-2"
        ],
        "recommended_course_ids": [
          "physics-mechanics"
        ],
        "concurrent_course_ids": [],
        "knowledge": [],
        "statement": "Recommended sequence: General Chemistry II; Classical Mechanics (recommended). These project-planned dependencies do not establish any university's admission or course-equivalency rules."
      },
      "related_package_ids": [],
      "relation_note": null
    },
    {
      "id": "circuits-1",
      "title": "Electrical Circuits I",
      "domain": "Electrical engineering",
      "level": "Year 2",
      "maturity": "catalog-only",
      "description": "Analyze resistive networks and first-order transient circuits with Kirchhoff laws, equivalent circuits, energy conservation, and measurement uncertainty.",
      "prerequisites": {
        "course_ids": [
          "physics-em"
        ],
        "recommended_course_ids": [
          "calculus-1"
        ],
        "concurrent_course_ids": [],
        "knowledge": [],
        "statement": "Recommended sequence: Electricity and Magnetism; Calculus I (recommended). These project-planned dependencies do not establish any university's admission or course-equivalency rules."
      },
      "related_package_ids": [
        "circuits"
      ],
      "relation_note": "This partial prototype package groups related topics; this catalog entry does not split or claim full-course coverage from that package."
    },
    {
      "id": "circuits-2",
      "title": "Electrical Circuits II",
      "domain": "Electrical engineering",